path,sentence
audios/2018/M0000000073_0049.wav,หนังอันดับหนึ่งเด็กดูได้ไหม
audios/2018/M0000000073_0050.wav,หนังอันดับสองเด็กดูได้ไหม
audios/2018/M0000000073_0051.wav,หนังอันดับสามเด็กดูได้ไหม
audios/2018/M0000000073_0052.wav,หนังอันดับสี่เด็กดูได้ไหม
audios/2018/M0000000073_0053.wav,หนังอันดับห้าเด็กดูได้ไหม
audios/2018/M0000000073_0054.wav,ใครคือนักแสดงนำหนังอันดับหนึ่ง
audios/2018/M0000000073_0055.wav,ใครคือนักแสดงนำหนังอันดับสอง
audios/2018/M0000000073_0056.wav,ใครคือนักแสดงนำหนังอันดับสาม
audios/2018/M0000000073_0057.wav,ใครคือนักแสดงนำหนังอันดับสี่
audios/2018/M0000000073_0058.wav,ใครคือนักแสดงนำหนังอันดับห้า
audios/2018/M0000000073_0059.wav,หนังอันดับหนึ่งใช้งบประมาณเท่าไหร่
audios/2018/M0000000073_0060.wav,หนังอันดับสองใช้งบประมาณเท่าไหร่
audios/2018/M0000000073_0061.wav,หนังอันดับสามใช้งบประมาณเท่าไหร่
audios/2018/M0000000073_0062.wav,หนังอันดับสี่ใช้งบประมาณเท่าไหร่
audios/2018/M0000000073_0063.wav,หนังอันดับห้าใช้งบประมาณเท่าไหร่
audios/2018/M0000000073_0064.wav,หนังอันดับหนึ่งทำรายได้เท่าไหร่
audios/2018/M0000000073_0065.wav,หนังอันดับสองทำรายได้เท่าไหร่
audios/2018/M0000000073_0066.wav,หนังอันดับสามทำรายได้เท่าไหร่
audios/2018/M0000000073_0067.wav,หนังอันดับสี่ทำรายได้เท่าไหร่
audios/2018/M0000000073_0068.wav,หนังอันดับห้าทำรายได้เท่าไหร่
audios/2018/M0000000073_0069.wav,หนังอันดับหนึ่งเป็นของค่ายไหน
audios/2018/M0000000073_0070.wav,หนังอันดับสองเป็นของค่ายไหน
audios/2018/M0000000073_0071.wav,หนังอันดับสามเป็นของค่ายไหน
audios/2018/M0000000073_0072.wav,หนังอันดับสี่เป็นของค่ายไหน
audios/2018/M0000000073_0073.wav,หนังอันดับห้าเป็นของค่ายไหน
audios/2018/M0000000073_0074.wav,หนังอันดับหนึ่งผลิตจากประเทศไหน
audios/2018/M0000000073_0075.wav,หนังอันดับสองผลิตจากประเทศไหน
audios/2018/M0000000073_0076.wav,หนังอันดับสามผลิตจากประเทศไหน
audios/2018/M0000000073_0077.wav,หนังอันดับสี่ผลิตจากประเทศไหน
audios/2018/M0000000073_0078.wav,หนังอันดับห้าผลิตจากประเทศไหน
audios/2018/M0000000073_0079.wav,หนังอันดับหนึ่งยาวเท่าไหร่
audios/2018/M0000000073_0080.wav,หนังอันดับสองยาวเท่าไหร่
audios/2018/M0000000073_0081.wav,หนังอันดับสามยาวเท่าไหร่
audios/2018/M0000000073_0082.wav,หนังอันดับสี่ยาวเท่าไหร่
audios/2018/M0000000073_0083.wav,หนังอันดับห้ายาวเท่าไหร่
audios/2018/M0000000073_0084.wav,หนังอันดับหนึ่งน่าดูไหม
audios/2018/M0000000073_0085.wav,หนังอันดับสองน่าดูไหม
audios/2018/M0000000073_0086.wav,หนังอันดับสามน่าดูไหม
audios/2018/M0000000073_0087.wav,หนังอันดับสี่น่าดูไหม
audios/2018/M0000000073_0088.wav,หนังอันดับห้าน่าดูไหม
audios/2018/M0000000073_0089.wav,มีตัวอย่างหนังอันดับหนึ่งให้ดูไหม
audios/2018/M0000000073_0090.wav,มีตัวอย่างหนังอันดับสองให้ดูไหม
audios/2018/M0000000073_0091.wav,มีตัวอย่างหนังอันดับสามให้ดูไหม
audios/2018/M0000000073_0092.wav,มีตัวอย่างหนังอันดับสี่ให้ดูไหม
audios/2018/M0000000073_0093.wav,มีตัวอย่างหนังอันดับห้าให้ดูไหม
audios/2018/M0000000073_0094.wav,หนังอันดับหนึ่งเกี่ยวกับอะไร
audios/2018/M0000000073_0095.wav,หนังอันดับสองเกี่ยวกับอะไร
audios/2018/M0000000073_0096.wav,หนังอันดับสามเกี่ยวกับอะไร
audios/2018/M0000000073_0097.wav,หนังอันดับสี่เกี่ยวกับอะไร
audios/2018/M0000000073_0098.wav,หนังอันดับห้าเกี่ยวกับอะไร
audios/2018/M0000000073_0099.wav,หนังน่าดูช่วงนี้
audios/2018/M0000000073_0100.wav,วันนี้มีอะไรน่าดูบ้าง
audios/2018/M0000000073_0101.wav,หนังอันดับหนึ่งยาวกี่นาที
audios/2018/M0000000073_0102.wav,หนังอันดับสองยาวกี่นาที
audios/2018/M0000000073_0103.wav,หนังอันดับสามยาวกี่นาที
audios/2018/M0000000073_0104.wav,หนังอันดับสี่ยาวกี่นาที
audios/2018/M0000000073_0105.wav,หนังอันดับห้ายาวกี่นาที
audios/2018/M0000000074_0000.wav,โกวาจี
audios/2018/M0000000074_0001.wav,โกวาจีมีหนังอะไรน่าดูบ้างช่วงนี้
audios/2018/M0000000074_0002.wav,ช่วงนี้มีหนังอะไรน่าดูบ้าง
audios/2018/M0000000074_0003.wav,มีอะไรน่าดูบ้าง
audios/2018/M0000000074_0004.wav,แนะนำหนังหน่อย
audios/2018/M0000000074_0005.wav,หาหนังให้ดูหน่อย
audios/2018/M0000000074_0006.wav,แสดงอันดับหนัง
audios/2018/M0000000074_0007.wav,แสดงสามอันดับหนังน่าดู
audios/2018/M0000000074_0008.wav,แสดงสามอันดับหนัง
audios/2018/M0000000074_0009.wav,แสดงห้าอันดับหนังน่าดู
audios/2018/M0000000074_0010.wav,แสดงห้าอันดับหนัง
audios/2018/M0000000074_0011.wav,แสดงอันดับหนังน่าดู
audios/2018/M0000000074_0012.wav,แสดงอันดับหนังมาใหม่
audios/2018/M0000000074_0013.wav,ขออันดับหนังมาใหม่
audios/2018/M0000000074_0014.wav,อันดับหนังมาใหม่
audios/2018/M0000000074_0015.wav,มีหนังอะไรเข้าฉายบ้าง
audios/2018/M0000000074_0016.wav,ตอนนี้หนังเรื่องอะไรอยู่ในโรงบ้าง
audios/2018/M0000000074_0017.wav,หนังอันดับที่หนึ่งได้คะแนนเท่าไหร่
audios/2018/M0000000074_0018.wav,หนังอันดับสองได้คะแนนเท่าไหร่
audios/2018/M0000000074_0019.wav,หนังอันดับสามได้คะแนนเท่าไหร่
audios/2018/M0000000074_0020.wav,หนังอันดับสี่ได้คะแนนเท่าไหร่
audios/2018/M0000000074_0021.wav,หนังอันดับห้าได้คะแนนเท่าไหร่
audios/2018/M0000000074_0022.wav,บอกเรื่องย่อหนังอันดับหนึ่ง
audios/2018/M0000000074_0023.wav,บอกเรื่องย่อหนังอันดับสอง
audios/2018/M0000000074_0024.wav,บอกเรื่องย่อหนังอันดับสาม
audios/2018/M0000000074_0025.wav,บอกเรื่องย่อหนังอันดับสี่
audios/2018/M0000000074_0026.wav,บอกเรื่องย่อหนังอันดับห้า
audios/2018/M0000000074_0027.wav,ขอดูตัวอย่างหนังอันดับแรก
audios/2018/M0000000074_0028.wav,ขอดูตัวอย่างหนังอันดับหนึ่ง
audios/2018/M0000000074_0029.wav,ขอดูตัวอย่างหนังอันดับสอง
audios/2018/M0000000074_0030.wav,ขอดูตัวอย่างหนังอันดับสาม
audios/2018/M0000000074_0031.wav,ขอดูตัวอย่างหนังอันดับสี่
audios/2018/M0000000074_0032.wav,ขอดูตัวอย่างหนังอันดับห้า
audios/2018/M0000000074_0033.wav,หนังอันดับหนึ่งเป็นหนังแนวไหน
audios/2018/M0000000074_0034.wav,หนังอันดับแรกเป็นหนังแนวไหน
audios/2018/M0000000074_0035.wav,หนังอันดับสองเป็นหนังแนวไหน
audios/2018/M0000000074_0036.wav,หนังอันดับสามเป็นหนังแนวไหน
audios/2018/M0000000074_0037.wav,หนังอันดับสี่เป็นหนังแนวไหน
audios/2018/M0000000074_0038.wav,หนังอันดับห้าเป็นหนังแนวไหน
audios/2018/M0000000074_0039.wav,ใครเป็นผู้กำกับหนังอันดับหนึ่ง
audios/2018/M0000000074_0040.wav,ใครเป็นผู้กำกับหนังอันดับสอง
audios/2018/M0000000074_0041.wav,ใครเป็นผู้กำกับหนังอันดับสาม
audios/2018/M0000000074_0042.wav,ใครเป็นผู้กำกับหนังอันดับสี่
audios/2018/M0000000074_0043.wav,ใครเป็นผู้กำกับหนังอันดับห้า
audios/2018/M0000000074_0044.wav,หนังอันดับหนึ่งเข้าฉายวันไหน
audios/2018/M0000000074_0045.wav,หนังอันดับสองเข้าฉายวันไหน
audios/2018/M0000000074_0046.wav,หนังอันดับสามเข้าฉายวันไหน
audios/2018/M0000000074_0047.wav,หนังอันดับสี่เข้าฉายวันไหน
audios/2018/M0000000074_0048.wav,หนังอันดับห้าเข้าฉายวันไหน
audios/2018/M0000000074_0049.wav,หนังอันดับหนึ่งเด็กดูได้ไหม
audios/2018/M0000000074_0050.wav,หนังอันดับสองเด็กดูได้ไหม
audios/2018/M0000000074_0051.wav,หนังอันดับสามเด็กดูได้ไหม
audios/2018/M0000000074_0052.wav,หนังอันดับสี่เด็กดูได้ไหม
audios/2018/M0000000074_0053.wav,หนังอันดับห้าเด็กดูได้ไหม
audios/2018/M0000000074_0054.wav,ใครคือนักแสดงนำหนังอันดับหนึ่ง
audios/2018/M0000000074_0055.wav,ใครคือนักแสดงนำหนังอันดับสอง
audios/2018/M0000000074_0056.wav,ใครคือนักแสดงนำหนังอันดับสาม
audios/2018/M0000000074_0057.wav,ใครคือนักแสดงนำหนังอันดับสี่
audios/2018/M0000000074_0058.wav,ใครคือนักแสดงนำหนังอันดับห้า
audios/2018/M0000000074_0059.wav,หนังอันดับหนึ่งใช้งบประมาณเท่าไหร่
audios/2018/M0000000074_0060.wav,หนังอันดับสองใช้งบประมาณเท่าไหร่
audios/2018/M0000000074_0061.wav,หนังอันดับสามใช้งบประมาณเท่าไหร่
audios/2018/M0000000074_0062.wav,หนังอันดับสี่ใช้งบประมาณเท่าไหร่
audios/2018/M0000000074_0063.wav,หนังอันดับห้าใช้งบประมาณเท่าไหร่
audios/2018/M0000000074_0064.wav,หนังอันดับหนึ่งทำรายได้เท่าไหร่
audios/2018/M0000000074_0065.wav,หนังอันดับสองทำรายได้เท่าไหร่
audios/2018/M0000000074_0066.wav,หนังอันดับสามทำรายได้เท่าไหร่
audios/2018/M0000000074_0067.wav,หนังอันดับสี่ทำรายได้เท่าไหร่
audios/2018/M0000000074_0068.wav,หนังอันดับห้าทำรายได้เท่าไหร่
audios/2018/M0000000074_0069.wav,หนังอันดับหนึ่งเป็นของค่ายไหน
audios/2018/M0000000074_0070.wav,หนังอันดับสองเป็นของค่ายไหน
audios/2018/M0000000074_0071.wav,หนังอันดับสามเป็นของค่ายไหน
audios/2018/M0000000074_0072.wav,หนังอันดับสี่เป็นของค่ายไหน
audios/2018/M0000000074_0073.wav,หนังอันดับห้าเป็นของค่ายไหน
audios/2018/M0000000074_0074.wav,หนังอันดับหนึ่งผลิตจากประเทศไหน
audios/2018/M0000000074_0075.wav,หนังอันดับสองผลิตจากประเทศไหน
audios/2018/M0000000074_0076.wav,หนังอันดับสามผลิตจากประเทศไหน
audios/2018/M0000000074_0077.wav,หนังอันดับสี่ผลิตจากประเทศไหน
audios/2018/M0000000074_0078.wav,หนังอันดับห้าผลิตจากประเทศไหน
audios/2018/M0000000074_0079.wav,หนังอันดับหนึ่งยาวเท่าไหร่
audios/2018/M0000000074_0080.wav,หนังอันดับสองยาวเท่าไหร่
audios/2018/M0000000074_0081.wav,หนังอันดับสามยาวเท่าไหร่
audios/2018/M0000000074_0082.wav,หนังอันดับสี่ยาวเท่าไหร่
audios/2018/M0000000074_0083.wav,หนังอันดับห้ายาวเท่าไหร่
audios/2018/M0000000074_0084.wav,หนังอันดับหนึ่งน่าดูไหม
audios/2018/M0000000074_0085.wav,หนังอันดับสองน่าดูไหม
audios/2018/M0000000074_0086.wav,หนังอันดับสามน่าดูไหม
audios/2018/M0000000074_0087.wav,หนังอันดับสี่น่าดูไหม
audios/2018/M0000000074_0088.wav,หนังอันดับห้าน่าดูไหม
audios/2018/M0000000074_0089.wav,มีตัวอย่างหนังอันดับหนึ่งให้ดูไหม
audios/2018/M0000000074_0090.wav,มีตัวอย่างหนังอันดับสองให้ดูไหม
audios/2018/M0000000074_0091.wav,มีตัวอย่างหนังอันดับสามให้ดูไหม
audios/2018/M0000000074_0092.wav,มีตัวอย่างหนังอันดับสี่ให้ดูไหม
audios/2018/M0000000074_0093.wav,มีตัวอย่างหนังอันดับห้าให้ดูไหม
audios/2018/M0000000074_0094.wav,หนังอันดับหนึ่งเกี่ยวกับอะไร
audios/2018/M0000000074_0095.wav,หนังอันดับสองเกี่ยวกับอะไร
audios/2018/M0000000074_0096.wav,หนังอันดับสามเกี่ยวกับอะไร
audios/2018/M0000000074_0097.wav,หนังอันดับสี่เกี่ยวกับอะไร
audios/2018/M0000000074_0098.wav,หนังอันดับห้าเกี่ยวกับอะไร
audios/2018/M0000000074_0099.wav,หนังน่าดูช่วงนี้
audios/2018/M0000000074_0100.wav,วันนี้มีอะไรน่าดูบ้าง
audios/2018/M0000000074_0101.wav,หนังอันดับหนึ่งยาวกี่นาที
audios/2018/M0000000074_0102.wav,หนังอันดับสองยาวกี่นาที
audios/2018/M0000000074_0103.wav,หนังอันดับสามยาวกี่นาที
audios/2018/M0000000074_0104.wav,หนังอันดับสี่ยาวกี่นาที
audios/2018/M0000000074_0105.wav,หนังอันดับห้ายาวกี่นาที
audios/2018/M0000000075_0000.wav,โกวาจี
audios/2018/M0000000075_0001.wav,โกวาจีเปิดหนึ่ง
audios/2018/M0000000075_0002.wav,เปิดห้า
audios/2018/M0000000075_0003.wav,เปิดสิบ
audios/2018/M0000000075_0004.wav,เปิดห้าสิบ
audios/2018/M0000000075_0005.wav,เปิดร้อย
audios/2018/M0000000075_0006.wav,ข้าม
audios/2018/M0000000075_0007.wav,พอได้แล้ว
audios/2018/M0000000075_0008.wav,หยุดเถอะขอร้อง
audios/2018/M0000000075_0009.wav,เปิดจนกว่าจะได้เอสอา
audios/2018/M0000000075_0010.wav,เปิดจนกว่าจะได้เอสเอสอา
audios/2018/M0000000075_0011.wav,เปิดจนกว่าจะได้เอเอสอา
audios/2018/M0000000075_0012.wav,เปิดจนกว่าจะได้มากิเอสเอสอา
audios/2018/M0000000075_0013.wav,เปิดจนกว่าจะได้ฮิจิริเอสอา
audios/2018/M0000000075_0014.wav,ฉันอยากเล่นเกม
audios/2018/M0000000075_0015.wav,ฉันเบื่อ
audios/2018/M0000000075_0016.wav,ฉันอยากเห็นสายรุ้ง
audios/2018/M0000000075_0017.wav,ฉันอยากเห็นสีทอง
audios/2018/M0000000075_0018.wav,ฉันอยากอวดอาจารย์เอกพล
audios/2018/M0000000075_0019.wav,อาจารย์อาจารย์ดูนี่สิ
audios/2018/M0000000075_0020.wav,อาจารย์อยากเห็นสีรุ้งมั้ย
audios/2018/M0000000075_0021.wav,บอกฉันทีว่าวันนี้ฉันดวงดีมั้ย
audios/2018/M0000000075_0022.wav,เพชรหมดแล้วทำไงดี
audios/2018/M0000000075_0023.wav,รับเงินจากทักษิณห้าร้อยบาท
audios/2018/M0000000075_0024.wav,ยืมเงินจากอาจารย์เอกพลห้าแสนบาท
audios/2018/M0000000075_0025.wav,ยืมเงินจากปาล์มห้าพันบาท
audios/2018/M0000000075_0026.wav,ยืมเงินจากโบ๊ทห้าร้อยบาท
audios/2018/M0000000075_0027.wav,ขโมยเงินจากธนาคารหนึ่งล้านบาท
audios/2018/M0000000075_0028.wav,ห้าร้อยเพชรราคากี่บาท
audios/2018/M0000000075_0029.wav,ห้าร้อยเพชรราคากี่เยน
audios/2018/M0000000075_0030.wav,ฉันเปิดไปกี่บาทแล้ว
audios/2018/M0000000075_0031.wav,อยากได้เมอร์ลินจังเลย
audios/2018/M0000000075_0032.wav,อยากได้เวเวอร์จังเลย
audios/2018/M0000000075_0033.wav,เติมเพชรสิบ
audios/2018/M0000000075_0034.wav,เติมเพชรห้าสิบ
audios/2018/M0000000075_0035.wav,เติมเพชรหนึ่งร้อย
audios/2018/M0000000075_0036.wav,เติมเพชรห้าร้อย
audios/2018/M0000000075_0037.wav,เติมเพชรหนึ่งพัน
audios/2018/M0000000075_0038.wav,ทวงเงินจากโบ๊ท
audios/2018/M0000000075_0039.wav,ทวงเงินจากปาล์ม
audios/2018/M0000000075_0040.wav,ทวงเงินจากเต๋อ
audios/2018/M0000000075_0041.wav,ทวงเงินจากโรนัน
audios/2018/M0000000075_0042.wav,ทวงเงินจากอาม
audios/2018/M0000000075_0043.wav,มีตู้อะไรบ้าง
audios/2018/M0000000075_0044.wav,ไม่อยากลุ้นนาน
audios/2018/M0000000075_0045.wav,ขายเรือดำน้ำ
audios/2018/M0000000075_0046.wav,ขายบ้าน
audios/2018/M0000000075_0047.wav,ขายรถ
audios/2018/M0000000075_0048.wav,ขายไต
audios/2018/M0000000075_0049.wav,ขายตับ
audios/2018/M0000000075_0050.wav,ตอนนี้เปิดได้อากี่ใบแล้ว
audios/2018/M0000000075_0051.wav,ตอนนี้เปิดได้เอเอสอากี่ใบแล้ว
audios/2018/M0000000075_0052.wav,ตอนนี้เปิดได้เอสเอสอากี่ใบแล้ว
audios/2018/M0000000075_0053.wav,ตอนนี้เปิดได้เอสอากี่ใบแล้ว
audios/2018/M0000000075_0054.wav,ตอนนี้เปิดได้ขยะกี่ใบแล้ว
audios/2018/M0000000075_0055.wav,พอเถอะ
audios/2018/M0000000075_0056.wav,ฉันมีหนี้เท่าไหร่
audios/2018/M0000000075_0057.wav,ฉันติดหนี้ปาล์มเท่าไร
audios/2018/M0000000075_0058.wav,ฉันติดหนี้โบ๊ทเท่าไร
audios/2018/M0000000075_0059.wav,ฉันติดหนี้โรนันเท่าไร
audios/2018/M0000000075_0060.wav,ฉันติดหนี้เต๋อเท่าไร
audios/2018/M0000000075_0061.wav,ฉันติดหนี้อามเท่าไร
audios/2018/M0000000075_0062.wav,ถอนเงินจากธนาคารกสิกรหมื่นบาท
audios/2018/M0000000075_0063.wav,ถอนเงินจากธนาคารไทยพาณิชย์หมื่นบาท
audios/2018/M0000000075_0064.wav,ถอนเงินจากธนาคารทหารไทยหมื่นบาท
audios/2018/M0000000075_0065.wav,ถอนเงินจากธนาคารกรุงเทพสี่หมื่นบาท
audios/2018/M0000000075_0066.wav,ถอนเงินจากธนาคารกรุงไทยห้าหมื่นบาท
audios/2018/M0000000075_0067.wav,เปลี่ยนเป็นตู้เฟทแกรนด์ออเดอร์
audios/2018/M0000000075_0068.wav,เปลี่ยนเป็นตู้เลิฟไลฟ์
audios/2018/M0000000075_0069.wav,เปลี่ยนเป็นตู้แกรนบลู
audios/2018/M0000000075_0070.wav,เปลี่ยนเป็นตู้ไอมาส
audios/2018/M0000000075_0071.wav,เปลี่ยนเป็นตู้เอเอสอา
audios/2018/M0000000075_0072.wav,ฉันมีเงินเท่าไร
audios/2018/M0000000075_0073.wav,ฉันมีเพชรเท่าไร
audios/2018/M0000000075_0074.wav,ตู้นี้มีเอสเอสอาใบไหนบ้าง
audios/2018/M0000000075_0075.wav,ตู้นี้มีเอสอาใบไหนบ้าง
audios/2018/M0000000075_0076.wav,ตู้นี้มีอาใบไหนบ้าง
audios/2018/M0000000075_0077.wav,ตู้นี้มีตัวลิมิตใบไหนบ้าง
audios/2018/M0000000075_0078.wav,ตู้นี้มีอาจารย์ใบไหนบ้าง
audios/2018/M0000000075_0079.wav,แสดงเอสเอสอาทั้งหมดที่ฉันมี
audios/2018/M0000000075_0080.wav,แสดงเอสอาทั้งหมดที่ฉันมี
audios/2018/M0000000075_0081.wav,แสดงเอเอสอาทั้งหมดที่ฉันมี
audios/2018/M0000000075_0082.wav,แสดงอาทั้งหมดที่ฉันมี
