path,sentence
audios/2017/F0000000006_0000.wav,โกวาจี
audios/2017/F0000000006_0001.wav,โกวาจีก๋วยเตี๋ยวในจุฬามีร้านไหนบ้าง
audios/2017/F0000000006_0002.wav,ข้าวหมูแดงในจุฬามีร้านไหนบ้าง
audios/2017/F0000000006_0003.wav,ข้าวมันไก่ในจุฬามีร้านไหนบ้าง
audios/2017/F0000000006_0004.wav,ร้านอาหารตามสั่งในจุฬามีร้านไหนบ้าง
audios/2017/F0000000006_0005.wav,ร้านสเต็กในจุฬามีร้านไหนบ้าง
audios/2017/F0000000006_0006.wav,ก๋วยเตี๋ยวรอบนอกจุฬามีร้านไหนบ้าง
audios/2017/F0000000006_0007.wav,ข้าวหมูแดงรอบนอกจุฬามีร้านไหนบ้าง
audios/2017/F0000000006_0008.wav,ข้าวมันไก่รอบนอกจุฬามีร้านไหนบ้าง
audios/2017/F0000000006_0009.wav,ร้านอาหารตามสั่งรอบนอกจุฬามีร้านไหนบ้าง
audios/2017/F0000000006_0010.wav,ร้านสเต็กรอบนอกจุฬามีร้านไหนบ้าง
audios/2017/F0000000006_0011.wav,อยากกินไก่ทอดที่ไหนอร่อย
audios/2017/F0000000006_0012.wav,อยากกินผัดไทยที่ไหนอร่อย
audios/2017/F0000000006_0013.wav,ร้านอาหารตามสั่งที่คณะวิศวะเปิดกี่โมง
audios/2017/F0000000006_0014.wav,ร้านก๋วยเตี๋ยวที่คณะวิศวะเปิดกี่โมง
audios/2017/F0000000006_0015.wav,ร้านข้าวมันไก่ที่คณะวิศวะเปิดกี่โมง
audios/2017/F0000000006_0016.wav,ไอติมพาราโบลามีตรงไหนบ้าง
audios/2017/F0000000006_0017.wav,ก๋วยเตี๋ยวอดทนรอนานไหม
audios/2017/F0000000006_0018.wav,มีเงินยี่สิบบาทกินอะไรได้บ้าง
audios/2017/F0000000006_0019.wav,เกาเหลาที่หอยูอร่อยไหม
audios/2017/F0000000006_0020.wav,ที่อักษรมีร้านไหนเด็ดเด็ดบ้าง
audios/2017/F0000000006_0021.wav,ที่วิศวะมีร้านไหนเด็ดเด็ดบ้าง
audios/2017/F0000000006_0022.wav,ที่บัญชีมีร้านไหนเด็ดเด็ดบ้าง
audios/2017/F0000000006_0023.wav,ที่เศรษฐศาสตร์มีร้านไหนเด็ดเด็ดบ้าง
audios/2017/F0000000006_0024.wav,เครปศาลาพระเกี้ยวไปอยู่ไหนแล้ว
audios/2017/F0000000006_0025.wav,มีเงินห้าสิบบาทกินอะไรดี
audios/2017/F0000000006_0026.wav,มีเงินหนึ่งร้อยบาทกินอะไรดี
audios/2017/F0000000006_0027.wav,มีเงินสองร้อยบาทกินอะไรดี
audios/2017/F0000000006_0028.wav,ที่นิติมีร้านไหนเด็ดเด็ดบ้าง
audios/2017/F0000000006_0029.wav,อยากกินสเต็กงบหนึ่งร้อยบาทที่ไหนดี
audios/2017/F0000000006_0030.wav,อยากกินสเต็กงบห้าร้อยบาทที่ไหนดี
audios/2017/F0000000006_0031.wav,อยากกินชาบูงบสามร้อยบาทที่ไหนดี
audios/2017/F0000000006_0032.wav,อยากกินชาบูงบห้าร้อยบาทที่ไหนดี
audios/2017/F0000000006_0033.wav,ช่วงนี้มีโปรโมชั่นอะไรน่าสนใจบ้าง
audios/2017/F0000000006_0034.wav,ส้มตำข้างแอมปาร์คปิดกี่โมง
audios/2017/F0000000006_0035.wav,ข้าวมันไก่เจ๊ดาวปิดกี่โมง
audios/2017/F0000000006_0036.wav,เกาเหลาสามหมูปิดกี่โมง
audios/2017/F0000000006_0037.wav,ร้านยยักษ์ปิดกี่โมง
audios/2017/F0000000006_0038.wav,มีร้านไหนมีปลั๊กไฟให้ชาร์จบ้าง
audios/2017/F0000000006_0039.wav,มีร้านไหนมีโปรโมชันบ้าง
audios/2017/F0000000006_0040.wav,มีร้านไหนมีไวไฟให้ใช้บ้าง
audios/2017/F0000000006_0041.wav,ปังเย็นมีกี่สาขา
audios/2017/F0000000006_0042.wav,มีร้านอาหารที่ไหนซื้อหนึ่งแถมหนึ่งบ้าง
audios/2017/F0000000006_0043.wav,มีร้านบุฟเฟต์ที่ไหนมาสี่จ่ายสามบ้าง
audios/2017/F0000000006_0044.wav,มีร้านอาหารที่ไหนเปิดเกินสี่ทุ่มบ้าง
audios/2017/F0000000006_0045.wav,กินอาหารร้านไอเดียใช้งบประมาณเท่าไหร่
audios/2017/F0000000006_0046.wav,กินเคเอฟซีใช้งบประมาณเท่าไหร่
audios/2017/F0000000006_0047.wav,โจ๊กสามย่านเปิดมากี่ปีแล้ว
audios/2017/F0000000006_0048.wav,โปรโมชันมาสี่จ่ายสามร้านมิยาบิหมดเขตวันไหน
audios/2017/F0000000006_0049.wav,ครีมเมอรี่มีไอติมรสใหม่อะไรบ้าง
audios/2017/F0000000006_0050.wav,พาราโบลาวันนี้มีรสอะไร
audios/2017/F0000000006_0051.wav,คณะวิศวะมีร้านขายผลไม้ไหม
audios/2017/F0000000006_0052.wav,ไอติมไผ่ทองมาขายที่คณะวิศวะกี่โมง
audios/2017/F0000000006_0053.wav,วันนี้โรงอาหารตึกจุลมีร้านไหนปิดบ้าง
audios/2017/F0000000006_0054.wav,วันนี้โรงอาหารคณะอักษรมีร้านไหนปิดบ้าง
audios/2017/F0000000006_0055.wav,พรุ่งนี้โรงอาหารหอในมีร้านไหนปิดบ้าง
audios/2017/F0000000006_0056.wav,พรุ่งนี้โรงอาหารมหิตมีร้านไหนปิดบ้าง
audios/2017/F0000000006_0057.wav,ขอเส้นทางไปโรงอาหารคณะแพทย์
audios/2017/F0000000006_0058.wav,ขอเส้นทางไปร้านก๋วยเตี๋ยวกัญชา
audios/2017/F0000000006_0059.wav,ร้านขนมหวานมีผลไม้ขายด้วยไหม
audios/2017/F0000000006_0060.wav,ตลาดนัดวันศุกร์จัดที่ไหน
audios/2017/F0000000006_0061.wav,ไอติมไผ่ทองขายยังไง
audios/2017/F0000000006_0062.wav,หมูปิ้งที่วิศวะขายไม้ละห้าบาทใช่ไหม
audios/2017/F0000000006_0063.wav,ได้ยินว่ามีตลาดนัดมันอยู่ตรงไหนนะ
audios/2017/F0000000006_0064.wav,โรตีลุงที่จามเก้าแบบใส่ไข่และกล้วยราคาเท่าไหร่
audios/2017/F0000000006_0065.wav,มันปิ้งที่คณะบัญชีขายทุกวันไหม
audios/2017/F0000000006_0066.wav,ไปเจ๊โอวตอนนี้คิวยาวมั้ย
audios/2017/F0000000006_0067.wav,ลุงฟรุตตี้ขายอะไรบ้าง
audios/2017/F0000000006_0068.wav,ขอพิกัดร้านขายน้ำดื่มขวดละห้าบาท
audios/2017/F0000000006_0069.wav,เจฟเฟอร์ที่จามสแควร์รับเหรียญสตางค์ไหม
audios/2017/F0000000006_0070.wav,บัวลอยสวีทเซอเคิลเมนูไหนน่ากิน
audios/2017/F0000000006_0071.wav,เซงเซียมอี๊เมนูไหนน่ากิน
audios/2017/F0000000006_0072.wav,ร้านก๋วยเตี๋ยวรุจิศรีเมนูไหนน่ากิน
audios/2017/F0000000006_0073.wav,ร้านห้าหอในเมนูไหนน่ากิน
audios/2017/F0000000006_0074.wav,เครปหอในสองไส้กี่บาท
audios/2017/F0000000006_0075.wav,จามสแควร์มีร้านฮาจิบังไหม
audios/2017/F0000000006_0076.wav,จามสแควร์มีร้านเจฟเฟอร์ไหม
audios/2017/F0000000006_0077.wav,จามสแควร์มีร้านยาโยอิไหม
audios/2017/F0000000006_0078.wav,จามสแควร์มีร้านโอโตยะไหม
audios/2017/F0000000006_0079.wav,จามสแควร์มีร้านเอ็มเคไหม
audios/2017/F0000000006_0080.wav,กล้วยปิ้งร้านไหนอร่อย
audios/2017/F0000000006_0081.wav,มีร้านไหนแถวจุฬาเปิดยี่สิบสี่ชั่วโมงบ้าง
audios/2017/F0000000006_0082.wav,มีเซเว่นกี่ที่ในจุฬา
audios/2017/F0000000006_0083.wav,มีอเมซอนกี่ที่ในจุฬา
audios/2017/F0000000006_0084.wav,อเมซอนที่คณะวิศวะลดราคากี่เปอร์เซ็นต์
audios/2017/F0000000006_0085.wav,คณะวิศวะมีร้านกาแฟกี่ร้าน
audios/2017/F0000000006_0086.wav,คณะบัญชีมีร้านอาหารตามสั่งกี่ร้าน
audios/2017/F0000000006_0087.wav,ขอรายชื่อสิบร้านเด็ดรอบจุฬา
audios/2017/F0000000006_0088.wav,ขอรายชื่อสิบเมนูเด็ดต้องโดนรอบจุฬา
audios/2017/F0000000006_0089.wav,เสือร้องไห้เจ๊อ้อยทำคนร้องไห้ไปกี่คนแล้ว
audios/2017/F0000000006_0090.wav,อยากกินฮาจิบังต้องมีเงินเท่าไร
audios/2017/F0000000006_0091.wav,ทูฟาสต์ทูสลีบไปยังไง
audios/2017/F0000000006_0092.wav,สคิปหอยูไปยังไง
audios/2017/F0000000006_0093.wav,ร้านสตาร์บัคในแอมปาร์คอยู่ชั้นไหน
audios/2017/F0000000006_0094.wav,มากินอาหารที่นี่กลับบีทีเอสสถานีอะไร
audios/2017/F0000000006_0095.wav,มากินอาหารที่นี่กลับเอมอาทีสถานีอะไร
audios/2017/F0000000006_0096.wav,มีร้านไหนมีที่จอดรถบ้าง
audios/2017/F0000000006_0097.wav,มีร้านไหนขายข้าวโพดคลุกเนยไหม
audios/2017/F0000000006_0098.wav,ระหว่างสเต็กร้านสเต็กสามย่านกับร้านทูเดย์สเต็กร้านไหนอร่อยกว่ากัน
audios/2017/F0000000006_0099.wav,ระหว่างก๋วยเตี๋ยวเรือร้านในวิศวะกับร้านในอักษรร้านไหนอร่อยกว่ากัน
audios/2017/F0000000006_0100.wav,ระหว่างส้มตำเจ๊แดงกับส้มตำเจ๊อ้อยร้านไหนอร่อยกว่ากัน
audios/2017/F0000000006_0101.wav,ระหว่างซอลบิงกับซอบิงโกร้านไหนบิงซูมะม่วงอร่อยกว่ากัน
audios/2017/F0000000007_0000.wav,โกวาจี
audios/2017/F0000000007_0001.wav,โกวาจีวันนี้ต้องทำอะไรบ้าง
audios/2017/F0000000007_0002.wav,วันนี้ต้องทำอะไรบ้าง
audios/2017/F0000000007_0003.wav,งานเยอะไหมวันนี้
audios/2017/F0000000007_0004.wav,วันนี้มีอะไรต้องทำบ้าง
audios/2017/F0000000007_0005.wav,บอกงานวันนี้หน่อย
audios/2017/F0000000007_0006.wav,วันนี้มีอะไรต้องสะสางบ้าง
audios/2017/F0000000007_0007.wav,วันนี้มีทำงานไรบ้าง
audios/2017/F0000000007_0008.wav,นอนต่อได้มั้ย
audios/2017/F0000000007_0009.wav,ง่วงจัง
audios/2017/F0000000007_0010.wav,ขออีกห้านาที
audios/2017/F0000000007_0011.wav,นอนต่ออีกห้านาที
audios/2017/F0000000007_0012.wav,อีกห้านาทีละกัน
audios/2017/F0000000007_0013.wav,อีกห้านาทีได้ไหม
audios/2017/F0000000007_0014.wav,อีกห้านาทีนะ
audios/2017/F0000000007_0015.wav,ขอนอนอีกห้านาทีนะ
audios/2017/F0000000007_0016.wav,อยากนอนต่ออีกห้านาทีอะ
audios/2017/F0000000007_0017.wav,ขออีกครึ่งชั่วโมง
audios/2017/F0000000007_0018.wav,นอนต่ออีกครึ่งชั่วโมง
audios/2017/F0000000007_0019.wav,อีกครึ่งชั่วโมงละกัน
audios/2017/F0000000007_0020.wav,อีกครึ่งชั่วโมงได้ไหม
audios/2017/F0000000007_0021.wav,อีกครึ่งชั่วโมงนะ
audios/2017/F0000000007_0022.wav,ขอนอนอีกครึ่งชั่วโมงนะ
audios/2017/F0000000007_0023.wav,อยากนอนต่ออีกครึ่งชั่วโมงอะ
audios/2017/F0000000007_0024.wav,ขออีกชั่วโมงนึงนะ
audios/2017/F0000000007_0025.wav,นอนต่ออีกชั่วโมงนึง
audios/2017/F0000000007_0026.wav,อีกชั่วโมงนึงละกัน
audios/2017/F0000000007_0027.wav,อีกชั่วโมงนึงได้ไหม
audios/2017/F0000000007_0028.wav,อีกชั่วโมงนึงนะ
audios/2017/F0000000007_0029.wav,ขอนอนอีกชั่วโมงนึงนะ
audios/2017/F0000000007_0030.wav,อยากนอนต่ออีกชั่วโมงนึงอะ
audios/2017/F0000000007_0031.wav,ไม่อยากตื่นเลยอะ
audios/2017/F0000000007_0032.wav,นอนต่ออีกหน่อยนะ
audios/2017/F0000000007_0033.wav,ขออีกแปปนึง
audios/2017/F0000000007_0034.wav,อยากนอนต่ออะ
audios/2017/F0000000007_0035.wav,เมื่อคืนนอนไม่หลับอะ
audios/2017/F0000000007_0036.wav,วันนี้ไม่รีบอีกชั่วโมงนะ
audios/2017/F0000000007_0037.wav,นอนต่อได้ไหมไม่สระผมแล้ว
audios/2017/F0000000007_0038.wav,ขี้เกียจสระผมแล้วนอนต่อนะ
audios/2017/F0000000007_0039.wav,วันนี้นอนได้ถึงกี่โมง
audios/2017/F0000000007_0040.wav,เลื่อนไปได้ถึงกี่โมง
audios/2017/F0000000007_0041.wav,ตื่นช้าสุดได้กี่โมง
audios/2017/F0000000007_0042.wav,อยากนอนต่อเยอะเยอะตื่นกี่โมงดี
audios/2017/F0000000007_0043.wav,คุยแบบเป็นกันเองก็ได้
audios/2017/F0000000007_0044.wav,คุยแบบเพื่อนกันก็ได้
audios/2017/F0000000007_0045.wav,เป็นเพื่อนเหรอคุยดีดีหน่อย
audios/2017/F0000000007_0046.wav,คุยแบบสุภาพหน่อยนะ
audios/2017/F0000000007_0047.wav,สุภาพหน่อย
audios/2017/F0000000007_0048.wav,เป็นกันเองหน่อย
audios/2017/F0000000007_0049.wav,ไม่ต้องสุภาพก็ได้นะ
audios/2017/F0000000007_0050.wav,ไม่ต้องเป็นกันเองขนาดนั้นก็ได้
audios/2017/F0000000007_0051.wav,พรุ่งนี้ปลุกเราหกโมงนะ
audios/2017/F0000000007_0052.wav,พรุ่งนี้เราต้องตื่นหกโมงนะ
audios/2017/F0000000007_0053.wav,ตื่นหกโมงนะพรุ่งนี้
audios/2017/F0000000007_0054.wav,ฉันตื่นหกโมงนะพรุ่งนี้
audios/2017/F0000000007_0055.wav,อย่าลืมปลุกตอนหกโมงนะ
audios/2017/F0000000007_0056.wav,ช่วยตั้งปลุกตอนหกโมงหน่อยนะ
audios/2017/F0000000007_0057.wav,ปลุกหกโมง
audios/2017/F0000000007_0058.wav,พรุ่งนี้ปลุกเราสิบโมงครึ่งนะ
audios/2017/F0000000007_0059.wav,พรุ่งนี้เราต้องตื่นสิบโมงครึ่งนะ
audios/2017/F0000000007_0060.wav,ตื่นสิบโมงครึ่งนะพรุ่งนี้
audios/2017/F0000000007_0061.wav,ฉันตื่นสิบโมงครึ่งนะพรุ่งนี้
audios/2017/F0000000007_0062.wav,อย่าลืมปลุกตอนสิบโมงครึ่งนะ
audios/2017/F0000000007_0063.wav,ช่วยตั้งปลุกตอนสิบโมงครึ่งหน่อยนะ
audios/2017/F0000000007_0064.wav,ปลุกสิบโมงครึ่งนะ
audios/2017/F0000000007_0065.wav,พรุ่งนี้ปลุกเราเที่ยงนะ
audios/2017/F0000000007_0066.wav,พรุ่งนี้เราต้องตื่นเที่ยงนะ
audios/2017/F0000000007_0067.wav,ตื่นเที่ยงนะพรุ่งนี้
audios/2017/F0000000007_0068.wav,ฉันตื่นเที่ยงนะพรุ่งนี้
audios/2017/F0000000007_0069.wav,อย่าลืมปลุกตอนเที่ยงนะ
audios/2017/F0000000007_0070.wav,ช่วยตั้งปลุกตอนเที่ยงหน่อยนะ
audios/2017/F0000000007_0071.wav,ปลุกเที่ยงนะ
audios/2017/F0000000007_0072.wav,อีกสิบชั่วโมงค่อยปลุกนะ
audios/2017/F0000000007_0073.wav,อีกห้านาทีค่อยปลุกนะ
audios/2017/F0000000007_0074.wav,ปลุกทุกวันตอนหกโมงเช้านะ
audios/2017/F0000000007_0075.wav,ปลุกทุกวันจันทร์พุธศุกร์ตอนสิบโมงนะ
audios/2017/F0000000007_0076.wav,ปลุกทุกวันที่ทำงานตอนเจ็ดโมงนะ
audios/2017/F0000000007_0077.wav,ปลุกวันหยุดนี้ตอนสิบเอ็ดโมงนะ
audios/2017/F0000000007_0078.wav,ตื่นกี่โมงดี
audios/2017/F0000000007_0079.wav,ตื่นตอนไหนดี
audios/2017/F0000000007_0080.wav,อยากตื่นเช้าเช้าอะกี่โมงดี
audios/2017/F0000000007_0081.wav,พรุ่งนี้ตื่นได้ช้าสุดกี่โมงเหรอ
audios/2017/F0000000007_0082.wav,พรุ่งนี้ตื่นกี่โมงดีอยากสระผมซักชั่วโมงนึง
audios/2017/F0000000007_0083.wav,พรุ่งนี้ตื่นกี่โมงดีอยากฟังเพลงก่อนซักสิบนาที
audios/2017/F0000000007_0084.wav,อยากตื่นมาอ่านหนังสือสองชั่วโมงอะตื่นกี่โมงดี
audios/2017/F0000000007_0085.wav,ตอนนี้กี่โมงแล้ว
audios/2017/F0000000007_0086.wav,กี่โมงแล้ว
audios/2017/F0000000007_0087.wav,อีกกี่นาทีแปดโมง
audios/2017/F0000000007_0088.wav,อีกนานไหมกว่าจะแปดโมง
audios/2017/F0000000007_0089.wav,อีกกี่นาทีแปดโมงครึ่ง
audios/2017/F0000000007_0090.wav,อีกกี่นาทีเที่ยง
audios/2017/F0000000007_0091.wav,อีกนานไหมกว่าจะเที่ยง
audios/2017/F0000000007_0092.wav,เที่ยงนี้อีกกี่นาที
audios/2017/F0000000007_0093.wav,อีกนานไหมกว่าจะแปดโมงครึ่ง
audios/2017/F0000000007_0094.wav,อีกสิบนาทีกี่โมง
audios/2017/F0000000007_0095.wav,อีกครึ่งชั่วโมงกี่โมง
audios/2017/F0000000007_0096.wav,ตื่นแล้ว
audios/2017/F0000000007_0097.wav,ไปอาบน้ำแล้วเนี่ย
audios/2017/F0000000007_0098.wav,ตื่นแล้วเฟ้ย
audios/2017/F0000000007_0099.wav,ลุกแล้วนะ
audios/2017/F0000000007_0100.wav,ตื่นแล้วเงียบได้แล้ว
audios/2017/F0000000007_0101.wav,ตื่นแล้วเนี่ย
audios/2017/F0000000007_0102.wav,อาบน้ำเสร็จแล้วจะออกจากบ้านแล้ว
audios/2017/F0000000008_0000.wav,โกวาจี
audios/2017/F0000000008_0001.wav,โกวาจีวันนี้ต้องทำอะไรบ้าง
audios/2017/F0000000008_0002.wav,วันนี้ต้องทำอะไรบ้าง
audios/2017/F0000000008_0003.wav,งานเยอะไหมวันนี้
audios/2017/F0000000008_0004.wav,วันนี้มีอะไรต้องทำบ้าง
audios/2017/F0000000008_0005.wav,บอกงานวันนี้หน่อย
audios/2017/F0000000008_0006.wav,วันนี้มีอะไรต้องสะสางบ้าง
audios/2017/F0000000008_0007.wav,วันนี้มีทำงานไรบ้าง
audios/2017/F0000000008_0008.wav,นอนต่อได้มั้ย
audios/2017/F0000000008_0009.wav,ง่วงจัง
audios/2017/F0000000008_0010.wav,ขออีกห้านาที
audios/2017/F0000000008_0011.wav,นอนต่ออีกห้านาที
audios/2017/F0000000008_0012.wav,อีกห้านาทีละกัน
audios/2017/F0000000008_0013.wav,อีกห้านาทีได้ไหม
audios/2017/F0000000008_0014.wav,อีกห้านาทีนะ
audios/2017/F0000000008_0015.wav,ขอนอนอีกห้านาทีนะ
audios/2017/F0000000008_0016.wav,อยากนอนต่ออีกห้านาทีอะ
audios/2017/F0000000008_0017.wav,ขออีกครึ่งชั่วโมง
audios/2017/F0000000008_0018.wav,นอนต่ออีกครึ่งชั่วโมง
audios/2017/F0000000008_0019.wav,อีกครึ่งชั่วโมงละกัน
audios/2017/F0000000008_0020.wav,อีกครึ่งชั่วโมงได้ไหม
audios/2017/F0000000008_0021.wav,อีกครึ่งชั่วโมงนะ
audios/2017/F0000000008_0022.wav,ขอนอนอีกครึ่งชั่วโมงนะ
audios/2017/F0000000008_0023.wav,อยากนอนต่ออีกครึ่งชั่วโมงอะ
audios/2017/F0000000008_0024.wav,ขออีกชั่วโมงนึงนะ
audios/2017/F0000000008_0025.wav,นอนต่ออีกชั่วโมงนึง
audios/2017/F0000000008_0026.wav,อีกชั่วโมงนึงละกัน
audios/2017/F0000000008_0027.wav,อีกชั่วโมงนึงได้ไหม
audios/2017/F0000000008_0028.wav,อีกชั่วโมงนึงนะ
audios/2017/F0000000008_0029.wav,ขอนอนอีกชั่วโมงนึงนะ
audios/2017/F0000000008_0030.wav,อยากนอนต่ออีกชั่วโมงนึงอะ
audios/2017/F0000000008_0031.wav,ไม่อยากตื่นเลยอะ
audios/2017/F0000000008_0032.wav,นอนต่ออีกหน่อยนะ
audios/2017/F0000000008_0033.wav,ขออีกแปปนึง
audios/2017/F0000000008_0034.wav,อยากนอนต่ออะ
audios/2017/F0000000008_0035.wav,เมื่อคืนนอนไม่หลับอะ
audios/2017/F0000000008_0036.wav,วันนี้ไม่รีบอีกชั่วโมงนะ
audios/2017/F0000000008_0037.wav,นอนต่อได้ไหมไม่สระผมแล้ว
