path,sentence
audios/2021/M0000000143_0001.wav,โกวาจีสองบวกสามคำนวณให้หน่อย
audios/2021/M0000000143_0002.wav,วงเล็บเปิดสองบวกสามสิบห้าวงเล็บปิดลบสามสิบสองคำนวณให้หน่อย
audios/2021/M0000000143_0003.wav,สองหมื่นห้าพันสี่ร้อยยี่สิบเอ็ดลบวงเล็บเปิดสองร้อยสามสิบสองคูณสามส่วนสี่วงเล็บปิดลบยี่สิบห้าเปอร์เซนต์คำนวณให้หน่อย
audios/2021/M0000000143_0004.wav,หนึ่งแสนแปดหมื่นสามพันสี่ร้อยเก้าสิบสามลบห้าสิบสองเปอร์เซนต์คำนวณให้หน่อย
audios/2021/M0000000143_0005.wav,สามสิบห้ายกกำลังวงเล็บเปิดสองคูณสามสิบสี่วงเล็บปิดยกกำลังวงเล็บเปิดสามลบสองร้อยห้าสิบสี่วงเล็บปิดคูณเจ็ดสิบเอ็ดคำนวณให้หน่อย
audios/2021/M0000000143_0006.wav,รูทเก้าพันแปดร้อยเจ็ดสิบหกปิดรูทคำนวณให้หน่อย
audios/2021/M0000000143_0007.wav,ล็อกสามสิบสองฐานสิบบวกล็อกวงเล็บเปิดยี่สิบสี่คูณแปดวงเล็บปิดฐานสิบสองคำนวณให้หน่อย
audios/2021/M0000000143_0008.wav,เศษหนึ่งส่วนสองพายคูณแปดสิบห้ายกกำลังวงเล็บเปิดสองวงเล็บปิดคำนวณให้หน่อย
audios/2021/M0000000143_0009.wav,เก้าแสนเจ็ดหมื่นแปดพันสามร้อยหกสิบห้าหารสี่สิบสองคำนวณให้หน่อย
audios/2021/M0000000143_0010.wav,สิบสองล้านแปดแสนสามหมื่นเจ็ดพันหกร้อยสามสิบเอ็ดลบเจ็ดเปอร์เซนต์บวกวงเล็บเปิดอียกกำลังวงเล็บปิดลบเจ็ดสิบสองวงเล็บเปิดบวกสามสิบสองวงเล็บปิดคำนวณให้หน่อย
audios/2021/M0000000143_0011.wav,แปดร้อยเจ็ดสิบสี่บวกเก้าร้อยสามสิบสองบวกหนึ่งพันสองร้อยบวกสองพันห้าร้อยห้าสิบคำนวณให้หน่อย
audios/2021/M0000000143_0012.wav,สองหมื่นสามพันสี่ร้อยห้าสิบห้าลบสิบสองจุดห้าเปอร์เซนต์บวกสามพันสองร้อยห้าสิบบวกสี่พันเก้าสิบห้าคำนวณให้หน่อย
audios/2021/M0000000143_0013.wav,ห้าร้อยหกสิบหารสิบห้าบวกวงเล็บเปิดวงเล็บเปิดสี่สิบสองคูณสองพันสามร้อยแปดสิบสี่วงเล็บปิดหารวงเล็บเปิดสี่สิบห้าคูณห้าสิบสองวงเล็บปิดวงเล็บปิดคำนวณให้หน่อย
audios/2021/M0000000143_0014.wav,วงเล็บเปิดสามแสนสามหมื่นสี่พันแปดร้อยหกสิบห้าคูณสิบสองยกกำลังวงเล็บเปิดห้าวงเล็บปิดวงเล็บปิดหารวงเล็บเปิดสองจุดสี่ห้าสองสามคูณสิบยกกำลังวงเล็บเปิดลบสิบสามวงเล็บปิดวงเล็บปิดคำนวณให้หน่อย
audios/2021/M0000000143_0015.wav,เก้าสิบห้าล้านบวกเจ็ดเปอร์เซนต์ลบวงเล็บเปิดสามแสนห้าหมื่นบวกวงเล็บเปิดสิบเจ็ดเปอร์เซนต์คูณเก้าสิบห้าล้านวงเล็บปิดวงเล็บปิดคำนวณให้หน่อย
audios/2021/M0000000143_0016.wav,สี่สิบห้าจุดศูนย์สองห้าคูณห้าร้อยสิบสองล้านแปดแสนเก้าหมื่นแปดพันสี่ร้อยสามสิบห้าหารวงเล็บเปิดห้าร้อยยี่สิบห้าคูณสิบยกกำลังวงเล็บเปิดสามวงเล็บปิดวงเล็บปิดคำนวณให้หน่อย
audios/2021/M0000000143_0017.wav,รูทเก้าปิดรูทคำนวณให้หน่อย
audios/2021/M0000000143_0018.wav,ล็อกสองพันห้าร้อยฐานสามคูณสิบสามหารสี่สิบสองคำนวณให้หน่อย
audios/2021/M0000000143_0019.wav,สามสิบสองล้านหกแสนสี่หมื่นเจ็ดพันสามร้อยสามสิบสองบวกวงเล็บเปิดวงเล็บเปิดสิบห้ายกกำลังวงเล็บเปิดลบสามวงเล็บปิดบวกสิบสี่ยกกำลังวงเล็บเปิดลบสองวงเล็บปิดบวกสิบสามยกกำลังวงเล็บเปิดลบหนึ่งวงเล็บปิดบวกสิบสองวงเล็บปิดบวกเจ็ดสิบสี่ลบห้าสิบสองวงเล็บปิดคำนวณให้หน่อย
audios/2021/M0000000143_0020.wav,ลบรูทแปดสิบสี่บวกหนึ่งจุดสองห้าสามปิดรูทลบศูนย์จุดสามแปดศูนย์สองคำนวณให้หน่อย
audios/2021/M0000000143_0021.wav,ลบเศษสิบห้าส่วนสามสิบสองบวกเศษสิบสี่ส่วนสิบหกลบเศษยี่สิบห้าส่วนหกสิบสี่คำนวณให้หน่อย
audios/2021/M0000000143_0022.wav,ลบห้าสิบสองบวกสี่สิบสองยกกำลังวงเล็บเปิดสามวงเล็บปิดหารวงเล็บเปิดสิบสี่คูณเศษห้าส่วนสิบสามวงเล็บปิดลบรูทแปดปิดรูทลบสิบสองจุดห้าสองสองคำนวณให้หน่อย
audios/2021/M0000000143_0023.wav,ยี่สิบห้าจุดสี่สองหนึ่งแปดบวกสิบล้านห้าแสนเจ็ดหมื่นลบสามพันหกร้อยเก้าสิบเอ็ดจุดศูนย์ศูนย์คำนวณให้หน่อย
audios/2021/M0000000143_0024.wav,สี่สิบห้าลบสองเปอร์เซนต์คำนวณให้หน่อย
audios/2021/M0000000143_0025.wav,วงเล็บเปิดเก้าสิบแปดบวกยี่สิบเอ็ดจุดหกเจ็ดสามลบพายวงเล็บปิดยกกำลังวงเล็บเปิดล็อกวงเล็บเปิดเก้าสิบแปดบวกยี่สิบเอ็ดจุดหกเจ็ดสามลบพายวงเล็บปิดฐานอีวงเล็บปิดคำนวณให้หน่อย
audios/2021/M0000000143_0026.wav,เศษรูทห้าปิดรูทส่วนรูทหนึ่งร้อยสามปิดรูทคำนวณให้หน่อย
audios/2021/M0000000143_0027.wav,เศษเก้าสิบห้าจุดเจ็ดแปดสองหนึ่งส่วนวงเล็บเปิดล็อกสี่ล้านหกฐานหนึ่งร้อยวงเล็บปิดยกกำลังวงเล็บเปิดเศษหนึ่งส่วนสองวงเล็บปิดคำนวณให้หน่อย
audios/2021/M0000000143_0028.wav,รูทวงเล็บเปิดล็อกเก้าพันหนึ่งร้อยหกสิบเจ็ดฐานเจ็ดสิบหกลบสามสิบเจ็ดวงเล็บปิดคูณเก้าหนึ่งร้อยปิดรูทคำนวณให้หน่อย
audios/2021/M0000000143_0029.wav,หนึ่งหนึ่งคูณหนึ่งสองห้าหารเก้าสิบเจ็ดลบห้าพันสามร้อยเอ็ดหารเจ็ดร้อยบวกหนึ่งล้านจุดศูนย์ศูนย์ศูนย์หนึ่งลบหนึ่งล้านจุดหนึ่งคำนวณให้หน่อย
audios/2021/M0000000143_0030.wav,หนึ่งหมื่นสองพันสามร้อยสี่สิบห้าล้านหกแสนเจ็ดหมื่นแปดพันเก้าร้อยยี่สิบเอ็ดลบหนึ่งหมื่นสองพันสามร้อยสี่สิบห้าล้านหกแสนเจ็ดหมื่นแปดพันเก้าร้อยสิบเอ็ดคำนวณให้หน่อย
audios/2021/M0000000143_0031.wav,เศษพายส่วนสี่คูณสามร้อยหกสิบบวกเก้าล้านเจ็ด
audios/2021/M0000000143_0032.wav,ล็อกห้าฐานสิบคำนวณให้หน่อย
audios/2021/M0000000143_0033.wav,อียกกำลังล็อกอีฐานอีคำนวณให้หน่อย
audios/2021/M0000000143_0034.wav,สองยกกำลังสามยกกำลังสองคำนวณให้หน่อย
audios/2021/M0000000143_0035.wav,วงเล็บเปิดสองยกกำลังสามวงเล็บปิดยกกำลังสองคำนวณให้หน่อย
audios/2021/M0000000143_0036.wav,รูทหกปิดรูทยกกำลังสองคำนวณให้หน่อย
audios/2021/M0000000143_0037.wav,สามจุดหนึ่งสี่หนึ่งห้าคำนวณให้หน่อย
audios/2021/M0000000143_0038.wav,ห้าแสนหกหารเจ็ดหมื่นเก้ายกกำลังเศษหนึ่งส่วนสองคำนวณให้หน่อย
audios/2021/M0000000143_0039.wav,วงเล็บเปิดรูทสองปิดรูทลบรูทห้าปิดรูทวงเล็บปิดหารวงเล็บเปิดรูทสองปิดรูทบวกรูทห้าปิดรูทวงเล็บปิดคูณเศษวงเล็บเปิดรูทสองปิดรูทลบรูทห้าปิดรูทวงเล็บปิดส่วนวงเล็บเปิดรูทสองปิดรูทลบรูทห้าปิดรูทวงเล็บปิดคำนวณให้หน่อย
audios/2021/M0000000143_0040.wav,หนึ่งสามหนึ่งคูณล็อกเจ็ดฐานเก้าคำนวณให้หน่อย
audios/2021/M0000000143_0041.wav,เก้าหกเจ็ดจุดเจ็ดหกเก้าบวกหนึ่งพันเปอร์เซ็นต์คำนวณให้หน่อย
audios/2021/M0000000143_0042.wav,สิบล้านยี่สิบเอ็ดหารวงเล็บเปิดสองบวกสามวงเล็บปิดคำนวณให้หน่อย
audios/2021/M0000000143_0043.wav,วงเล็บเปิดสิบสี่คูณแปดหารสองพันสิบแปดลบล็อกสองพันห้าร้อยหกสิบเอ็ดฐานหนึ่งล้านวงเล็บปิดยกกำลังหนึ่งคำนวณให้หน่อย
audios/2021/M0000000143_0044.wav,สองพันบวกสามสิบวงเล็บเปิดสิบคูณเจ็ดร้อยวงเล็บปิดคำนวณให้หน่อย
audios/2021/M0000000143_0045.wav,วงเล็บเปิดสี่ร้อยคูณพายวงเล็บปิดหารล็อกเก้าฐานสามคำนวณให้หน่อย
audios/2021/M0000000143_0046.wav,เก้าร้อยสิบเอ็ดบวกแปดสิบเจ็ดลบเจ็ดพันสองร้อยสี่สิบสี่ลบห้าร้อยหนึ่งบวกหนึ่งสองหนึ่งคำนวณให้หน่อย
audios/2021/M0000000143_0047.wav,เศษวงเล็บเปิดสามสิบสี่ส่วนยี่สิบสองวงเล็บปิดบวกวงเล็บเปิดห้าสิบเอ็ดคูณเจ็ดวงเล็บปิดคำนวณให้หน่อย
audios/2021/M0000000143_0048.wav,รูทสิบหกปิดรูทคูณสามล้านคำนวณให้หน่อย
audios/2021/M0000000143_0049.wav,วงเล็บเปิดสามร้อยยกกำลังสองวงเล็บปิดหารวงเล็บเปิดสี่คูณหกวงเล็บปิดคำนวณให้หน่อย
audios/2021/M0000000143_0050.wav,ลบวงเล็บเปิดหนึ่งพันห้าร้อยสี่สิบสี่คูณสามร้อยสี่สิบสี่วงเล็บปิดบวกสามพันสองร้อยสิบแปดคำนวณให้หน่อย
audios/2021/M0000000143_0051.wav,วงเล็บเปิดเจ็ดยกกำลังลบหนึ่งวงเล็บปิดคูณสี่สิบเก้าคำนวณให้หน่อย
audios/2021/M0000000143_0052.wav,วงเล็บเปิดสี่คูณสามสิบสองวงเล็บปิดหารสองยกกำลังหกคำนวณให้หน่อย
audios/2021/M0000000143_0053.wav,ศูนย์บวกศูนย์คูณหนึ่งหารสามบวกวงเล็บเปิดหนึ่งหารสองวงเล็บปิดคำนวณให้หน่อย
audios/2021/M0000000143_0054.wav,หนึ่งลบศูนย์บวกเก้าแสนเก้าหมื่นแปดพันเอ็ดคำนวณให้หน่อย
audios/2021/M0000000143_0055.wav,วงเล็บเปิดศูนย์คูณเจ็ดจุดหกเก้าคูณวงเล็บเปิดลบหนึ่งจุดแปดสองวงเล็บปิดวงเล็บปิดคำนวณให้หน่อย
audios/2021/M0000000143_0056.wav,วงเล็บเปิดหนึ่งจุดห้าหารศูนย์จุดห้าวงเล็บปิดยกกำลังสองคำนวณให้หน่อย
audios/2021/M0000000143_0057.wav,ล็อกสามพันฐานอีบวกหนึ่งร้อยยี่สิบจุดสามพันสี่คำนวณให้หน่อย
audios/2021/M0000000143_0058.wav,รูทยี่สิบยกกำลังเจ็ดสิบเอ็ดจุดเก้าปิดรูทคำนวณให้หน่อย
audios/2021/M0000000143_0059.wav,วงเล็บเปิดเศษสามส่วนสองวงเล็บปิดคูณวงเล็บเปิดล็อกหนึ่งล้านหารหนึ่งร้อยฐานสิบวงเล็บปิดคำนวณให้หน่อย
audios/2021/M0000000143_0060.wav,วงเล็บเปิดสี่จุดเก้าแปดหกสองศูนย์ศูนย์หกลบหนึ่งสองหนึ่งสองวงเล็บปิดยกกำลังเก้าคำนวณให้หน่อย
audios/2021/M0000000143_0061.wav,วงเล็บเปิดสองแสนหารห้าสิบวงเล็บปิดหารวงเล็บเปิดแปดพันสิบหารแปดร้อยเอ็ดวงเล็บปิดคำนวณให้หน่อย
audios/2021/M0000000143_0062.wav,รูทสิบยกกำลังหนึ่งร้อยปิดรูทคูณรูทเก้ายกกำลังพายปิดรูทคำนวณให้หน่อย
audios/2021/M0000000143_0063.wav,เก้าพันแปดสิบสองล้านบวกสี่สิบสองล้านสามแสนสองหมื่นเจ็ดคำนวณให้หน่อย
audios/2021/M0000000143_0064.wav,เศษพายส่วนพายบวกอีลบอีคำนวณให้หน่อย
audios/2021/M0000000143_0065.wav,สองหารสามเอ็กซ์เท่ากับสิบแปดลบสามคำนวณให้หน่อย
audios/2021/M0000000143_0066.wav,ลบยี่สิบสี่คูณสิบแปดเท่ากับยี่สิบห้าหารเอ็กซ์คำนวณให้หน่อย
audios/2021/M0000000143_0067.wav,ห้าเท่ากับยี่สิบห้าเอ็กซ์บวกแปดคำนวณให้หน่อย
audios/2021/M0000000143_0068.wav,สองร้อยยี่สิบสี่หารเอ็กซ์บวกเศษหนึ่งส่วนสองเท่ากับหนึ่งพันคำนวณให้หน่อย
audios/2021/M0000000143_0069.wav,สิบหารลบเศษสามส่วนสี่เท่ากับเอ็กซ์บวกสิบห้าลบสามคำนวณให้หน่อย
audios/2021/M0000000143_0070.wav,สองเอ็กซ์บวกสามเท่ากับห้าคำนวณให้หน่อย
audios/2021/M0000000143_0071.wav,เศษสองส่วนสามเอ็กซ์เท่ากับแปดร้อยสิบสองคำนวณให้หน่อย
audios/2021/M0000000143_0072.wav,เอ็กซ์บวกสี่หมื่นสามพันสามร้อยสิบเอ็ดเท่ากับสิบสามคำนวณให้หน่อย
audios/2021/M0000000143_0073.wav,เศษเอ็กซ์ส่วนสี่เท่ากับแปดสิบคำนวณให้หน่อย
audios/2021/M0000000143_0074.wav,สองยกกำลังสองเอ็กซ์เท่ากับสี่สิบห้าหารสิบห้าคำนวณให้หน่อย
audios/2021/M0000000143_0075.wav,พายคูณสิบห้าหารสามเท่ากับสามร้อยสิบแปดล้านสองแสนสามหมื่นสี่พันสิบเอ็ดเอ็กซ์คำนวณให้หน่อย
audios/2021/M0000000143_0076.wav,เศษสองเปิดวงเล็บสามบวกเอ็กซ์วงเล็บปิดส่วนสี่สิบแปดเท่ากับสองร้อยสิบสองคำนวณให้หน่อย
audios/2021/M0000000143_0077.wav,ลบเอ็กซ์บวกสามเท่ากับสี่คำนวณให้หน่อย
audios/2021/M0000000143_0078.wav,สองจุดสี่ห้าสามลบสามจุดสี่แปดเอ็กซ์เท่ากับยี่สิบห้าล้านสองคำนวณให้หน่อย
audios/2021/M0000000143_0079.wav,สามร้อยแปดสิบแปดจุดสี่สามแปดบวกเอ็กซ์ลบสามสิบแปดเท่ากับสี่สิบแปดหารสี่จุดสามสองเก้าคำนวณให้หน่อย
audios/2021/M0000000143_0080.wav,ล็อกสามสิบเก้าล้านฐานสิบหกบวกยี่สิบเอ็กซ์เท่ากับเก้าสิบเก้าล้านเก้าหมื่นเก้าร้อยเก้าสิบเก้าจุดเก้าเก้าเก้าคำนวณให้หน่อย
audios/2021/M0000000143_0081.wav,เอ็กซ์ยกกำลังวงเล็บเปิดสองบวกสิบแปดวงเล็บปิดบวกสิบห้าเท่ากับยี่สิบสองล้านสามแสนสี่สิบเอ็ดคูณห้าคำนวณให้หน่อย
audios/2021/M0000000143_0082.wav,ลบสามบวกสี่สิบเอ็กซ์เท่ากับล็อกสองฐานสองคำนวณให้หน่อย
audios/2021/M0000000143_0083.wav,สิบสามเท่ากับวงเล็บเปิดเศษสามส่วนสี่สิบเอ็กซ์บวกเก้าสิบแปดวงเล็บปิดหารวงเล็บเปิดสามลบสี่วงเล็บปิดคำนวณให้หน่อย
audios/2021/M0000000143_0084.wav,ล็อกวงเล็บเปิดสามบวกสองเอ็กซ์วงเล็บปิดเท่ากับสี่สิบเก้าบวกห้าหารสามคำนวณให้หน่อย
audios/2021/M0000000143_0085.wav,ร้อยสิบแปดล้านสามหมื่นสี่พันสามร้อยสิบแปดหารสองร้อยยี่สิบเก้าเท่ากับห้าพันสิบสามหารเอ็กซ์คำนวณให้หน่อย
audios/2021/M0000000143_0086.wav,สามล้านห้าแสนเอ็กซ์บวกหกหมื่นเท่ากับหนึ่งล้านสองหมื่นหนึ่งพันเจ็ดร้อยคำนวณให้หน่อย
audios/2021/M0000000143_0087.wav,วงเล็บเปิดสองลบห้าวงเล็บปิดคูณแปดเท่ากับสิบเอ็กซ์คำนวณให้หน่อย
audios/2021/M0000000143_0088.wav,ยี่สิบเอ็ดเอ็กซ์คูณวงเล็บเปิดสามสิบบวกห้าร้อยเอ็ดวงเล็บปิดเท่ากับล็อกแปดฐานสองคำนวณให้หน่อย
audios/2021/M0000000143_0089.wav,วงเล็บเปิดรูทสามร้อยบวกหกสิบปิดรูทวงเล็บปิดคำนวณให้หน่อย
audios/2021/M0000000143_0090.wav,ล็อกหนึ่งร้อยฐานสิบบวกสิบเอ็ดเอ็กซ์เท่ากับร้อยเอ็ดคำนวณให้หน่อย
audios/2021/M0000000143_0091.wav,ห้าแปดเจ็ดบวกสี่ห้าสามเก้าคำนวณให้หน่อย
audios/2021/M0000000143_0092.wav,ศูนย์คูณวงเล็บเปิดสามห้าเจ็ดบวกห้าสิบหกวงเล็บปิดคำนวณให้หน่อย
audios/2021/M0000000143_0093.wav,ห้าแปดลบสิบหารเจ็ดห้าคูณอียกกำลังสิบคำนวณให้หน่อย
audios/2021/M0000000143_0094.wav,เศษแปดส่วนสองเอ็กซ์บวกเศษพายส่วนห้าเท่ากับหนึ่งหมื่นห้าร้อยคำนวณให้หน่อย
