path,sentence
audios/2017/M0000000032_0029.wav,ขอนอนอีกชั่วโมงนึงนะ
audios/2017/M0000000032_0030.wav,อยากนอนต่ออีกชั่วโมงนึงอะ
audios/2017/M0000000032_0031.wav,ไม่อยากตื่นเลยอะ
audios/2017/M0000000032_0032.wav,นอนต่ออีกหน่อยนะ
audios/2017/M0000000032_0033.wav,ขออีกแปปนึง
audios/2017/M0000000032_0034.wav,อยากนอนต่ออะ
audios/2017/M0000000032_0035.wav,เมื่อคืนนอนไม่หลับอะ
audios/2017/M0000000032_0036.wav,วันนี้ไม่รีบอีกชั่วโมงนะ
audios/2017/M0000000032_0037.wav,นอนต่อได้ไหมไม่สระผมแล้ว
audios/2017/M0000000032_0038.wav,ขี้เกียจสระผมแล้วนอนต่อนะ
audios/2017/M0000000032_0039.wav,วันนี้นอนได้ถึงกี่โมง
audios/2017/M0000000032_0040.wav,เลื่อนไปได้ถึงกี่โมง
audios/2017/M0000000032_0041.wav,ตื่นช้าสุดได้กี่โมง
audios/2017/M0000000032_0042.wav,อยากนอนต่อเยอะเยอะตื่นกี่โมงดี
audios/2017/M0000000032_0043.wav,คุยแบบเป็นกันเองก็ได้
audios/2017/M0000000032_0044.wav,คุยแบบเพื่อนกันก็ได้
audios/2017/M0000000032_0045.wav,เป็นเพื่อนเหรอคุยดีดีหน่อย
audios/2017/M0000000032_0046.wav,คุยแบบสุภาพหน่อยนะ
audios/2017/M0000000032_0047.wav,สุภาพหน่อย
audios/2017/M0000000032_0048.wav,เป็นกันเองหน่อย
audios/2017/M0000000032_0049.wav,ไม่ต้องสุภาพก็ได้นะ
audios/2017/M0000000032_0050.wav,ไม่ต้องเป็นกันเองขนาดนั้นก็ได้
audios/2017/M0000000032_0051.wav,พรุ่งนี้ปลุกเราหกโมงนะ
audios/2017/M0000000032_0052.wav,พรุ่งนี้เราต้องตื่นหกโมงนะ
audios/2017/M0000000032_0053.wav,ตื่นหกโมงนะพรุ่งนี้
audios/2017/M0000000032_0054.wav,ฉันตื่นหกโมงนะพรุ่งนี้
audios/2017/M0000000032_0055.wav,อย่าลืมปลุกตอนหกโมงนะ
audios/2017/M0000000032_0056.wav,ช่วยตั้งปลุกตอนหกโมงหน่อยนะ
audios/2017/M0000000032_0057.wav,ปลุกหกโมง
audios/2017/M0000000032_0058.wav,พรุ่งนี้ปลุกเราสิบโมงครึ่งนะ
audios/2017/M0000000032_0059.wav,พรุ่งนี้เราต้องตื่นสิบโมงครึ่งนะ
audios/2017/M0000000032_0060.wav,ตื่นสิบโมงครึ่งนะพรุ่งนี้
audios/2017/M0000000032_0061.wav,ฉันตื่นสิบโมงครึ่งนะพรุ่งนี้
audios/2017/M0000000032_0062.wav,อย่าลืมปลุกตอนสิบโมงครึ่งนะ
audios/2017/M0000000032_0063.wav,ช่วยตั้งปลุกตอนสิบโมงครึ่งหน่อยนะ
audios/2017/M0000000032_0064.wav,ปลุกสิบโมงครึ่งนะ
audios/2017/M0000000032_0065.wav,พรุ่งนี้ปลุกเราเที่ยงนะ
audios/2017/M0000000032_0066.wav,พรุ่งนี้เราต้องตื่นเที่ยงนะ
audios/2017/M0000000032_0067.wav,ตื่นเที่ยงนะพรุ่งนี้
audios/2017/M0000000032_0068.wav,ฉันตื่นเที่ยงนะพรุ่งนี้
audios/2017/M0000000032_0069.wav,อย่าลืมปลุกตอนเที่ยงนะ
audios/2017/M0000000032_0070.wav,ช่วยตั้งปลุกตอนเที่ยงหน่อยนะ
audios/2017/M0000000032_0071.wav,ปลุกเที่ยงนะ
audios/2017/M0000000032_0072.wav,อีกสิบชั่วโมงค่อยปลุกนะ
audios/2017/M0000000032_0073.wav,อีกห้านาทีค่อยปลุกนะ
audios/2017/M0000000032_0074.wav,ปลุกทุกวันตอนหกโมงเช้านะ
audios/2017/M0000000032_0075.wav,ปลุกทุกวันจันทร์พุธศุกร์ตอนสิบโมงนะ
audios/2017/M0000000032_0076.wav,ปลุกทุกวันที่ทำงานตอนเจ็ดโมงนะ
audios/2017/M0000000032_0077.wav,ปลุกวันหยุดนี้ตอนสิบเอ็ดโมงนะ
audios/2017/M0000000032_0078.wav,ตื่นกี่โมงดี
audios/2017/M0000000032_0079.wav,ตื่นตอนไหนดี
audios/2017/M0000000032_0080.wav,อยากตื่นเช้าเช้าอะกี่โมงดี
audios/2017/M0000000032_0081.wav,พรุ่งนี้ตื่นได้ช้าสุดกี่โมงเหรอ
audios/2017/M0000000032_0082.wav,พรุ่งนี้ตื่นกี่โมงดีอยากสระผมซักชั่วโมงนึง
audios/2017/M0000000032_0083.wav,พรุ่งนี้ตื่นกี่โมงดีอยากฟังเพลงก่อนซักสิบนาที
audios/2017/M0000000032_0084.wav,อยากตื่นมาอ่านหนังสือสองชั่วโมงอะตื่นกี่โมงดี
audios/2017/M0000000032_0085.wav,ตอนนี้กี่โมงแล้ว
audios/2017/M0000000032_0086.wav,กี่โมงแล้ว
audios/2017/M0000000032_0087.wav,อีกกี่นาทีแปดโมง
audios/2017/M0000000032_0088.wav,อีกนานไหมกว่าจะแปดโมง
audios/2017/M0000000032_0089.wav,อีกกี่นาทีแปดโมงครึ่ง
audios/2017/M0000000032_0090.wav,อีกกี่นาทีเที่ยง
audios/2017/M0000000032_0091.wav,อีกนานไหมกว่าจะเที่ยง
audios/2017/M0000000032_0092.wav,เที่ยงนี้อีกกี่นาที
audios/2017/M0000000032_0093.wav,อีกนานไหมกว่าจะแปดโมงครึ่ง
audios/2017/M0000000032_0094.wav,อีกสิบนาทีกี่โมง
audios/2017/M0000000032_0095.wav,อีกครึ่งชั่วโมงกี่โมง
audios/2017/M0000000032_0096.wav,ตื่นแล้ว
audios/2017/M0000000032_0097.wav,ไปอาบน้ำแล้วเนี่ย
audios/2017/M0000000032_0098.wav,ตื่นแล้วเฟ้ย
audios/2017/M0000000032_0099.wav,ลุกแล้วนะ
audios/2017/M0000000032_0100.wav,ตื่นแล้วเงียบได้แล้ว
audios/2017/M0000000032_0101.wav,ตื่นแล้วเนี่ย
audios/2017/M0000000032_0102.wav,อาบน้ำเสร็จแล้วจะออกจากบ้านแล้ว
audios/2017/M0000000033_0000.wav,โกวาจี
audios/2017/M0000000033_0001.wav,โกวาจีอีกชั่วโมงนึงปลุกด้วย
audios/2017/M0000000033_0002.wav,อีกสองชั่วโมงปลุกด้วย
audios/2017/M0000000033_0003.wav,อีกยี่สิบนาทีปลุกด้วย
audios/2017/M0000000033_0004.wav,อีกครึ่งชั่วโมงปลุกด้วย
audios/2017/M0000000033_0005.wav,เตือนด้วยพรุ่งนี้มีประชุมสามโมง
audios/2017/M0000000033_0006.wav,เตือนด้วยมะรืนนี้มีประชุมหนึ่งทุ่ม
audios/2017/M0000000033_0007.wav,วันที่สิบมีนามีงานเตือนด้วย
audios/2017/M0000000033_0008.wav,ของีบสักสิบนาที
audios/2017/M0000000033_0009.wav,อีกชั่วโมงครึ่งต้องออกจากบ้านแล้ว
audios/2017/M0000000033_0010.wav,สิบห้านาทีปลุก
audios/2017/M0000000033_0011.wav,พรุ่งนี้มีนัดสิบโมง
audios/2017/M0000000033_0012.wav,วันที่ยี่สิบสามสิงหามีนัดเตือนด้วย
audios/2017/M0000000033_0013.wav,นับถอยหลังสามสิบนาที
audios/2017/M0000000033_0014.wav,นับถอยหลังสิบวินาที
audios/2017/M0000000033_0015.wav,นับถอยหลังสองชั่วโมง
audios/2017/M0000000033_0016.wav,อีกสิบนาทีเตือนด้วย
audios/2017/M0000000033_0017.wav,พรุ่งนี้ปลุกเก้าโมง
audios/2017/M0000000033_0018.wav,บ่ายโมงมีธุระ
audios/2017/M0000000033_0019.wav,แปดโมงมีธุระ
audios/2017/M0000000033_0020.wav,ปลุกสี่สิบนาที
audios/2017/M0000000033_0021.wav,เตือนครึ่งชั่วโมง
audios/2017/M0000000033_0022.wav,ปลุกตีสี่พรุ่งนี้
audios/2017/M0000000033_0023.wav,เตือนเที่ยงคืนมีงาน
audios/2017/M0000000033_0024.wav,ปลุกเที่ยงด้วย
audios/2017/M0000000033_0025.wav,เตือนด้วยมีประชุมวันที่สามสิบมีนาตอนสามโมง
audios/2017/M0000000033_0026.wav,เตือนพรุ่งนี้มีงานเจ็ดโมง
audios/2017/M0000000033_0027.wav,อีกห้าวันมีประชุม
audios/2017/M0000000033_0028.wav,เดือนหน้ามีงาน
audios/2017/M0000000033_0029.wav,ประชุมทุ่มนึง
audios/2017/M0000000033_0030.wav,วันที่เจ็ดเดือนหน้ามีงาน
audios/2017/M0000000033_0031.wav,อีกสองชั่วโมงประชุม
audios/2017/M0000000033_0032.wav,อีกสิบเอ็ดวันมีงาน
audios/2017/M0000000033_0033.wav,วันนี้มีงานบ่ายสอง
audios/2017/M0000000033_0034.wav,วันที่สิบเจ็ดเดือนกุมภามีงาน
audios/2017/M0000000033_0035.wav,ประชุมครั้งต่อไปวันไหน
audios/2017/M0000000033_0036.wav,งานต่อไปวันไหน
audios/2017/M0000000033_0037.wav,ประชุมกี่โมง
audios/2017/M0000000033_0038.wav,พรุ่งนี้ว่างมั้ย
audios/2017/M0000000033_0039.wav,วันนี้เหลืองานอะไรบ้าง
audios/2017/M0000000033_0040.wav,อาทิตย์นี้ว่างวันไหนบ้าง
audios/2017/M0000000033_0041.wav,วันพฤหัสเย็นมีนัดสี่โมง
audios/2017/M0000000033_0042.wav,อีกกี่ชั่วโมงจะถึงเวลานัด
audios/2017/M0000000033_0043.wav,มีนัดกับหมอบ่ายโมงวันศุกร์
audios/2017/M0000000033_0044.wav,มีนัดกับหมอกี่โมง
audios/2017/M0000000033_0045.wav,กี่โมงแล้ว
audios/2017/M0000000033_0046.wav,วันนี้วันที่เท่าไหร่
audios/2017/M0000000033_0047.wav,วันนี้วันอะไร
audios/2017/M0000000033_0048.wav,วันพุธมีนัดมั้ย
audios/2017/M0000000033_0049.wav,พรุ่งนี้มีงานอะไรบ้าง
audios/2017/M0000000033_0050.wav,งานพรุ่งนี้มีอะไรบ้าง
audios/2017/M0000000033_0051.wav,งานวันนี้มีอะไรบ้าง
audios/2017/M0000000033_0052.wav,วันที่แปดว่างมั้ย
audios/2017/M0000000033_0053.wav,เช้านี้มีงานหรือเปล่า
audios/2017/M0000000033_0054.wav,วันจันทร์มีเรียนแปดโมง
audios/2017/M0000000033_0055.wav,อีกกี่วันถึงวันเสาร์
audios/2017/M0000000033_0056.wav,วันพุธปลุกหกโมง
audios/2017/M0000000033_0057.wav,พรุ่งนี้ปลุกตอนตีห้า
audios/2017/M0000000033_0058.wav,ปลุกแปดโมงทุกวัน
audios/2017/M0000000033_0059.wav,พรุ่งนี้ไม่ต้องปลุก
audios/2017/M0000000033_0060.wav,ยกเลิกงานประชุมตอนสี่โมงเย็นวันนี้
audios/2017/M0000000033_0061.wav,วันศุกร์ยกเลิกงานประชุมตอนบ่าย
audios/2017/M0000000033_0062.wav,ยกเลิกกิจกรรมพรุ่งนี้ทั้งหมด
audios/2017/M0000000033_0063.wav,สี่โมงเย็นวันเสาร์ติดธุระอะไรมั้ย
audios/2017/M0000000033_0064.wav,เลื่อนเวลาปลุกไปสิบนาที
audios/2017/M0000000033_0065.wav,ขอนอนต่ออีกห้านาที
audios/2017/M0000000033_0066.wav,เลื่อนนัดวันพุธไปเป็นวันศุกร์
audios/2017/M0000000033_0067.wav,เลื่อนประชุมจากบ่ายโมงเป็นสี่โมง
audios/2017/M0000000033_0068.wav,เปลี่ยนประชุมวันนี้เป็นวันที่สิบเอ็ด
audios/2017/M0000000033_0069.wav,ประชุมคราวที่แล้วเมื่อวันไหน
audios/2017/M0000000033_0070.wav,เมื่อวานฉันไปประชุมตอนกี่โมง
audios/2017/M0000000033_0071.wav,วันเสาร์ที่แล้วมีธุระอะไรมั้ย
audios/2017/M0000000033_0072.wav,พุธหน้าสี่โมงเย็นมีประชุม
audios/2017/M0000000033_0073.wav,พรุ่งนี้ปลุกแปดโมงเช้า
audios/2017/M0000000033_0074.wav,ขอนอนต่ออีกสิบนาที
audios/2017/M0000000033_0075.wav,พรุ่งนี้บ่ายถึงบ่ายสามไม่ว่าง
audios/2017/M0000000033_0076.wav,ประชุมล่าสุดวันไหน
audios/2017/M0000000033_0077.wav,เลื่อนประชุมจากวันอังคารไปวันพุธ
audios/2017/M0000000033_0078.wav,วันศุกร์นี้มีสอบ
audios/2017/M0000000033_0079.wav,เคลียร์ตารางสัปดาห์หน้า
audios/2017/M0000000033_0080.wav,เคลียร์ตารางทั้งหมดของสัปดาห์หน้า
audios/2017/M0000000033_0081.wav,วันศุกร์มีงานมั้ย
audios/2017/M0000000033_0082.wav,ปลุกอีกสี่สิบสองนาที
audios/2017/M0000000033_0083.wav,วันศุกร์มีประชุมบ่ายโมง
audios/2017/M0000000033_0084.wav,ประชุมครั้งหน้าวันไหน
audios/2017/M0000000033_0085.wav,เสาร์หน้ามีงานมั้ย
audios/2017/M0000000033_0086.wav,ตีสามครึ่งเรียกด้วย
audios/2017/M0000000033_0087.wav,ย้ายงานตอนสามโมงไปห้าโมง
audios/2017/M0000000033_0088.wav,ย้ายงานวันเสาร์ไปวันจันทร์
audios/2017/M0000000033_0089.wav,วันนี้ไม่ว่างทั้งวัน
audios/2017/M0000000033_0090.wav,เดือนนี้ไม่ว่างทั้งเดือน
audios/2017/M0000000033_0091.wav,วันพฤหัสนี้มีสอบ
audios/2017/M0000000033_0092.wav,พุธนี้ส่งงานเที่ยงคืน
audios/2017/M0000000033_0093.wav,สิบห้านาทีมีประชุม
audios/2017/M0000000033_0094.wav,เสาร์นี้มีปาร์ตี้
audios/2017/M0000000033_0095.wav,นัดเย็นนี้ยกเลิก
audios/2017/M0000000033_0096.wav,ประชุมพรุ่งนี้เปลี่ยนเป็นสี่โมง
audios/2017/M0000000033_0097.wav,อีกยี่สิบนาทีกลับบ้าน
audios/2017/M0000000033_0098.wav,วันนี้สองทุ่มมีนัดกินข้าว
audios/2017/M0000000033_0099.wav,สิบนาทีแล้วเตือนด้วย
audios/2017/M0000000033_0100.wav,ขอพักห้านาที
audios/2017/M0000000033_0101.wav,วันอังคารห้าโมงถึงหกโมงไม่ว่าง
audios/2018/M0000000034_0000.wav,โกวาจี
audios/2018/M0000000034_0001.wav,โกวาจีกะเพราไก่ทำยังไง
audios/2018/M0000000034_0002.wav,ข้าวผัดกุ้งทำยังไง
audios/2018/M0000000034_0003.wav,ไข่กระจายทำยังไง
audios/2018/M0000000034_0004.wav,ต้มยำกุ้งทำยังไง
audios/2018/M0000000034_0005.wav,ปลาหมึกผัดไข่เค็มทำยังไง
audios/2018/M0000000034_0006.wav,กะเพราไก่ใช้เวลาทำประมาณเท่าไหร่
audios/2018/M0000000034_0007.wav,ข้าวผัดกุ้งใช้เวลาทำประมาณเท่าไหร่
audios/2018/M0000000034_0008.wav,ไข่กระจายใช้เวลาทำประมาณเท่าไหร่
audios/2018/M0000000034_0009.wav,ต้มยำกุ้งใช้เวลาทำประมาณเท่าไหร่
audios/2018/M0000000034_0010.wav,ปลาหมึกผัดไข่เค็มใช้เวลาทำประมาณเท่าไหร่
audios/2018/M0000000034_0011.wav,กะเพราไก่มีส่วนผสมอะไรบ้าง
audios/2018/M0000000034_0012.wav,ข้าวผัดกุ้งมีส่วนผสมอะไรบ้าง
audios/2018/M0000000034_0013.wav,ไข่กระจายมีส่วนผสมอะไรบ้าง
audios/2018/M0000000034_0014.wav,ต้มยำกุ้งมีส่วนผสมอะไรบ้าง
audios/2018/M0000000034_0015.wav,ปลาหมึกผัดไข่เค็มมีส่วนผสมอะไรบ้าง
audios/2018/M0000000034_0016.wav,กะเพราไก่ทำยากไหม
audios/2018/M0000000034_0017.wav,ข้าวผัดกุ้งทำยากไหม
audios/2018/M0000000034_0018.wav,ไข่กระจายทำยากไหม
audios/2018/M0000000034_0019.wav,ต้มยำกุ้งทำยากไหม
audios/2018/M0000000034_0020.wav,ปลาหมึกผัดไข่เค็มทำยากไหม
audios/2018/M0000000034_0021.wav,แนะนำเมนูของหวานหน่อย
audios/2018/M0000000034_0022.wav,แนะนำเมนูสุขภาพหน่อย
audios/2018/M0000000034_0023.wav,แนะนำเมนูอาหารไทยหน่อย
audios/2018/M0000000034_0024.wav,แนะนำเมนูอาหารตะวันตกหน่อย
audios/2018/M0000000034_0025.wav,แนะนำเมนูอาหารตะวันออกหน่อย
audios/2018/M0000000034_0026.wav,กะเพราไก่มีนมไหม
audios/2018/M0000000034_0027.wav,ข้าวผัดกุ้งมีถั่วไหม
audios/2018/M0000000034_0028.wav,ไข่กระจายมีกุ้งไหม
audios/2018/M0000000034_0029.wav,ต้มยำกุ้งมีเห็ดไหม
audios/2018/M0000000034_0030.wav,ปลาหมึกผัดไข่เค็มมีนมไหม
audios/2018/M0000000034_0031.wav,ขอเมนูที่ไม่ใส่กุ้ง
audios/2018/M0000000034_0032.wav,ขอเมนูที่ไม่ใส่ถั่ว
audios/2018/M0000000034_0033.wav,ขอเมนูที่ไม่ใส่ผัก
audios/2018/M0000000034_0034.wav,ขอเมนูที่ไม่ใส่หมู
audios/2018/M0000000034_0035.wav,ขอเมนูที่ไม่ใส่กระเทียม
audios/2018/M0000000034_0036.wav,กะเพราไก่มีแคลอรี่เท่าไหร่
audios/2018/M0000000034_0037.wav,ข้าวผัดกุ้งมีแคลอรี่เท่าไหร่
audios/2018/M0000000034_0038.wav,ไข่กระจายมีแคลอรี่เท่าไหร่
audios/2018/M0000000034_0039.wav,ต้มยำกุ้งมีแคลอรี่เท่าไหร่
audios/2018/M0000000034_0040.wav,ปลาหมึกผัดไข่เค็มมีแคลอรี่เท่าไหร่
audios/2018/M0000000034_0041.wav,ขอเมนูน้อยกว่าสี่ร้อยกิโลแคลอรี่
audios/2018/M0000000034_0042.wav,กะเพราไก่เผ็ดไหม
audios/2018/M0000000034_0043.wav,ข้าวผัดกุ้งหวานไหม
audios/2018/M0000000034_0044.wav,ไข่กระจายเปรี้ยวไหม
audios/2018/M0000000034_0045.wav,ต้มยำกุ้งหวานไหม
audios/2018/M0000000034_0046.wav,ปลาหมึกผัดไข่เค็มเค็มไหม
audios/2018/M0000000034_0047.wav,กะเพราไก่รสชาติเป็นยังไง
audios/2018/M0000000034_0048.wav,ข้าวผัดกุ้งรสชาติเป็นยังไง
audios/2018/M0000000034_0049.wav,ไข่กระจายรสชาติเป็นยังไง
audios/2018/M0000000034_0050.wav,ต้มยำกุ้งรสชาติเป็นยังไง
audios/2018/M0000000034_0051.wav,ปลาหมึกผัดไข่เค็มรสชาติเป็นยังไง
audios/2018/M0000000034_0052.wav,ขั้นต่อไป
audios/2018/M0000000034_0053.wav,ขั้นก่อนหน้า
audios/2018/M0000000034_0054.wav,เสร็็จ
audios/2018/M0000000034_0055.wav,หยุด
audios/2018/M0000000034_0056.wav,พูดอีกครั้ง
audios/2018/M0000000034_0057.wav,อะไรนะ
audios/2018/M0000000034_0058.wav,จับเวลาหนึ่งนาที
audios/2018/M0000000034_0059.wav,จับเวลาสองนาที
audios/2018/M0000000034_0060.wav,จับเวลาห้านาที
audios/2018/M0000000034_0061.wav,จับเวลาสิบห้านาที
audios/2018/M0000000034_0062.wav,จับเวลาสามสิบนาที
audios/2018/M0000000034_0063.wav,เหลือเวลาอีกกี่นาที
audios/2018/M0000000034_0064.wav,เมนูโปรดของฉันคือกะเพราไก่
audios/2018/M0000000034_0065.wav,เมนูโปรดของฉันคือข้าวผัดกุ้ง
audios/2018/M0000000034_0066.wav,เมนูโปรดของฉันคือไข่กระจาย
audios/2018/M0000000034_0067.wav,เมนูโปรดของฉันคือต้มยำกุ้ง
audios/2018/M0000000034_0068.wav,เมนูโปรดของฉันคือปลาหมึกผัดไข่เค็ม
audios/2018/M0000000034_0069.wav,ฉันกินกะเพราไก่ล่าสุดเมื่อไหร่
audios/2018/M0000000034_0070.wav,ฉันกินข้าวผัดกุ้งล่าสุดเมื่อไหร่
audios/2018/M0000000034_0071.wav,ฉันกินไข่กระจายล่าสุดเมื่อไหร่
audios/2018/M0000000034_0072.wav,ฉันกินต้มยำกุ้งล่าสุดเมื่อไหร่
audios/2018/M0000000034_0073.wav,ฉันกินปลาหมึกผัดไข่เค็มล่าสุดเมื่อไหร่
audios/2018/M0000000034_0074.wav,ฉันกินกะเพราไก่บ่อยไหม
audios/2018/M0000000034_0075.wav,ฉันกินข้าวผัดกุ้งบ่อยไหม
audios/2018/M0000000034_0076.wav,ฉันกินไข่กระจายบ่อยไหม
audios/2018/M0000000034_0077.wav,ฉันกินต้มยำกุ้งบ่อยไหม
audios/2018/M0000000034_0078.wav,ฉันกินปลาหมึกผัดไข่เค็มบ่อยไหม
audios/2018/M0000000034_0079.wav,สองช้อนโต๊ะเท่ากับกี่ช้อนชา
audios/2018/M0000000034_0080.wav,หนึ่งถ้วยตวงเท่ากับกี่มิลลิลิตร
audios/2018/M0000000034_0081.wav,เคล็ดลับทำอาหารประจำวัน
audios/2018/M0000000034_0082.wav,เช้านี้กินอะไรดี
audios/2018/M0000000034_0083.wav,เที่ยงนี้กินอะไรดี
